{
  "ecosystem": "gmd",
  "ticket_id": "UP8-GOLDEN-GMD-001",
  "goal": "Prove one clean end-to-end AMOF delivery baseline for gmd dev.",
  "scope": {
    "repos": ["gmd-app"],
    "allowed_paths": [
      "repos/gmd-app/**",
      "infrastructure/gitops/gmd/**",
      "ecosystems/gmd/**"
    ],
    "blocked_paths": ["**/.git/**", "**/.env", "**/node_modules/**"]
  },
  "constraints": [
    "no broad cleanup",
    "no retired demo-microsaas extension",
    "ticket worktrees are execution lanes, not delivery truth",
    "Cursor remains bootstrap/debug plane"
  ],
  "target_environment": "dev",
  "build_mode": "commit_detached",
  "deploy_mode": "argocd_application",
  "release_intent": {
    "type": "patch_alpha_then_promote",
    "component": "amof-delivery-plane"
  },
  "acceptance_criteria": [
    "fresh baseline captured",
    "ticket created and bound to gmd dev",
    "build uses explicit source commit evidence",
    "Argo application is synced and healthy",
    "Cloudflare/DNS and live URL checks pass",
    "release bump and promotion receipts exist",
    "final readback matches runtime truth"
  ]
}
