{
  "ecosystem": "gmd",
  "ticket_id": "UP8-GOLDEN-GMD-DEV-DIRECTOR-001",
  "goal": "Execute the proven local gmd-dev golden deploy/readback path through the Director/orchestrator authority and return a structured result.",
  "scope": {
    "repos": ["gmd-app"],
    "allowed_paths": [
      "repos/gmd-app/**",
      "infrastructure/gitops/gmd/**",
      "ecosystems/gmd/**",
      "ecosystems/amof-platform/audit/2026-04-25-ultra-plan-8-wave2-*.json"
    ],
    "blocked_paths": [
      "**/.git/**",
      "**/.env",
      "**/node_modules/**",
      "infrastructure/gitops/gmd/applicationset.yaml"
    ]
  },
  "constraints": [
    "dev-only",
    "local-only",
    "no test or prod",
    "do not touch cloud-dev",
    "do not touch real cloud production",
    "do not perform release or promote in this slice",
    "use the already-proven substrate path only: local k3d -> gmd-dev -> Argo CD Application -> ClusterIP frontend -> local port-forward readback",
    "do not edit source GitOps files; local ApplicationSet runtime patch from Wave 1 is the current substrate"
  ],
  "target_environment": "dev",
  "build_mode": "existing_chart_and_upstream_images",
  "deploy_mode": "local_argocd_application_existing_dev_only_applicationset",
  "release_intent": {
    "type": "none",
    "reason": "Wave 2 proves Director-run deploy/readback only; release/promote remain explicitly out of scope."
  },
  "acceptance_criteria": [
    "Director/orchestrator is the execution authority after kickoff",
    "only gmd-dev is targeted",
    "Argo application gmd-dev is Synced and Healthy",
    "gmd-dev workload pods are running",
    "local readback succeeds through ClusterIP frontend port-forward",
    "structured result records run ids, deploy result, readback result, and blocker classification if any",
    "release/promote are not attempted"
  ]
}
